{
  "$schema": "https://json-schema.org/draft/2020-12/schema",
  "$id": "https://matriya.example/schemas/decision-workspace/v1.0.json",
  "title": "MATRIYA Decision Workspace",
  "description": "STABLE v1.0. A Decision Workspace is NOT an engine. It assembles the emissions of an Engine Graph (observations, evidence, explanations, predictions, candidates, recommendations, trade-offs, risks, confidence, missing evidence) for one Scientific Task into a single decision SURFACE that a human reasons over. It emits NO decision. The Human Decision happens OUTSIDE the Engine Platform; only the RESULT of that decision re-enters the system as a Knowledge Event (closing the learning loop). This is the architectural home of the v1.1 Decision Boundary. Documentation only; no runtime behaviour.",
  "type": "object",
  "additionalProperties": false,
  "required": ["apiVersion", "workspaceId", "task", "isEngine", "producesDecision", "humanDecisionExternal", "surface", "contributingEmissions", "humanDecision"],
  "properties": {
    "apiVersion": { "const": "decision-workspace/v1.0" },
    "workspaceId": { "type": "string" },
    "task": {
      "description": "The Scientific Task this workspace serves.",
      "type": "object",
      "additionalProperties": false,
      "required": ["taskId"],
      "properties": {
        "taskId": { "type": "string" },
        "intent": { "type": "string" }
      }
    },
    "isEngine": { "const": false, "description": "A workspace is never an engine." },
    "producesDecision": { "const": false, "description": "The workspace never emits a decision — it assembles the surface a human decides on." },
    "humanDecisionExternal": { "const": true, "description": "The decision is a human act, outside the Engine Platform." },
    "surface": {
      "description": "The assembled decision surface — engine emissions only, never a decision. Everything a human needs to decide, and nothing that decides for them.",
      "type": "object",
      "additionalProperties": false,
      "properties": {
        "alternatives": { "type": "array", "description": "Candidate options / recommendations under consideration." },
        "tradeOffs": { "type": "array" },
        "risks": { "type": "array" },
        "evidenceQuality": { "type": "object", "description": "Confidence + provenance summary per alternative." },
        "uncertainty": { "type": "object" },
        "missingEvidence": { "type": "array", "description": "What is not yet known — feeds Knowledge Gap / Experiment Planner." },
        "whatIf": { "type": "array", "description": "Scenario projections (still engine predictions, never decisions)." }
      }
    },
    "contributingEmissions": {
      "description": "Provenance/transparency of the surface: which capability (and, for transparency, which engine) produced each emission. Emission kinds come from the Engine Contract v1.1 `emits` vocabulary — 'decision' is not among them.",
      "type": "array",
      "items": {
        "type": "object",
        "additionalProperties": false,
        "required": ["emits", "capability"],
        "properties": {
          "emits": { "enum": ["observation", "evidence", "explanation", "prediction", "candidate", "recommendation", "trade_off", "risk", "confidence", "missing_evidence"] },
          "capability": { "type": "string", "description": "The Capability Ontology id that produced it." },
          "engine": { "type": "string", "description": "For transparency: the engine that provided the capability." },
          "ref": { "type": "string" }
        }
      }
    },
    "humanDecision": {
      "description": "Recorded AFTER a human decides, OUTSIDE the platform. Until then, status is 'pending'. The decision itself is not computed here; only its record and its link to the resulting Knowledge Event.",
      "type": "object",
      "additionalProperties": false,
      "required": ["status"],
      "properties": {
        "status": { "enum": ["pending", "recorded"] },
        "decidedBy": { "type": "string", "description": "The human (role/id) who decided — never an engine." },
        "decidedAt": { "type": "string" },
        "choice": { "type": "string", "description": "What the human chose (references an alternative)." },
        "rationale": { "type": "string" },
        "resultingKnowledgeEvent": { "type": "string", "description": "The Knowledge Event id generated by acting on the decision — the loop back into the system." }
      }
    }
  },
  "allOf": [
    {
      "$comment": "v1.1 Decision Boundary — a workspace never decides. These three consts are the structural guarantee.",
      "properties": {
        "isEngine": { "const": false },
        "producesDecision": { "const": false },
        "humanDecisionExternal": { "const": true }
      }
    },
    {
      "$comment": "A recorded human decision must be attributed to a human and should link the Knowledge Event that carries its result back into the learning loop.",
      "if": { "properties": { "humanDecision": { "properties": { "status": { "const": "recorded" } }, "required": ["status"] } }, "required": ["humanDecision"] },
      "then": { "properties": { "humanDecision": { "required": ["status", "decidedBy", "choice"] } } }
    }
  ]
}
